<?xml version="1.0" encoding="UTF-8" standalone="no"?>
<!DOCTYPE ItemSet SYSTEM "R2_Flash_UI.dtd">
<ItemSet> 
  <Item Sample="Yes" ID="sample item" Version="0.0" Template="1" SequenceNo="">
	 <StudentDirections>Student Directions are optional. To add them to a
		particular Item, use the Insert Student Directions Toolbar
		button.</StudentDirections> 
	 <LeadIn><P>Lead In is optional. To add to a particular Item, use the Insert
		Lead In Toolbar button. A Lead In may contain P paragraphs, Graphics, Text
		Boxes, Directions, Excerpts, Ordered Lists, Unordered Lists or Equations. </P> 
	 </LeadIn> 
	 <Stimulus> 
		<Passage><P>Stimulus is optional. To add a Stimulus to an Item, use the
		  Insert Stimulus Toolbar button.</P><P>Every Stimulus requires either a Graphic,
		  Heading, Directive or Passage.</P> 
		</Passage> 
	 </Stimulus> 
	 <Stem><P>Add required Stem here. A Stem may contain P paragraphs, Graphics,
		Text Boxes, Ordered Lists, Unordered Lists, and Equations. </P> 
	 </Stem><SelectedResponse> 
	 <AnswerChoice Type="Distractor" ID="1">Add Answer/Choice Here</AnswerChoice> 
	 <AnswerChoice Type="Correct" ID="2">Add Answer/Choice Here</AnswerChoice> 
	 <AnswerChoice Type="Distractor" ID="3">Add Answer/Choice Here</AnswerChoice> 
	 <AnswerChoice Type="Distractor" ID="4">Add Answer/Choice
		Here</AnswerChoice></SelectedResponse> 
	 <Comments> <Comment UserName="carolv" DateStamp="Thursday, November 19, 2002">This is a Comment within a sample Item.
	 To add a Comment, use the Insert Comment Toolbar button. Please either replace
	 the content in this Item or delete this Item from your document after adding in
	 your own Item content from the repository. </Comment></Comments> 
  </Item> 
</ItemSet>
